{
  "version": "0.1",
  "app": {
    "name": "habit_tracker",
    "title": "Habit Tracker"
  },
  "entities": {
    "Habit": {
      "fields": {
        "name": {
          "type": "string",
          "required": true
        },
        "active": {
          "type": "boolean",
          "required": true,
          "default": true
        },
        "frequency": {
          "type": "enum",
          "values": [
            "daily",
            "weekly"
          ],
          "required": true
        }
      }
    },
    "Completion": {
      "fields": {
        "habit": {
          "type": "reference",
          "entity": "Habit",
          "required": true
        },
        "completed_at": {
          "type": "datetime",
          "required": true
        }
      }
    }
  },
  "pages": [
    {
      "name": "Habits",
      "route": "/habits",
      "type": "list",
      "entity": "Habit"
    },
    {
      "name": "NewHabit",
      "route": "/habits/new",
      "type": "create",
      "entity": "Habit"
    },
    {
      "name": "EditHabit",
      "route": "/habits/:id/edit",
      "type": "edit",
      "entity": "Habit"
    },
    {
      "name": "HabitDetails",
      "route": "/habits/:id",
      "type": "detail",
      "entity": "Habit"
    }
  ]
}
